{
 "min_disp": 8,
 "block": 5,
 "uniqueness": 10,
 "speckle_window": 150,
 "speckle_range": 2,
 "disp12": 1,
 "prefilter_cap": 31,
 "min_depth": 0.2,
 "max_depth": 2.0,
 "num_disp": {
  "d415": 96,
  "d435": 64
 },
 "_note": "Frozen on opaque-twin IR pairs of tuning scenes (seeds 1000-1019 per variant, final FOVs): d415 99.3/0.5/0.2, d435 99.6/0.2/0.2 correct/missing/wrong at 5% (GT-valid pixels)."
}